{
  "schemaVersion": 1,
  "id": "canvas-settings-logo-gallery",
  "title": "Logo gallery",
  "description": "Upload a Logo for the preset-generated gallery page.",
  "order": 40,
  "enabled": true,
  "slots": [{"id": "gallery.options", "accepts": ["field"],
    "orderBy": ["order", "presetId", "id"]}],
  "fields": []
}
