{
  "schemaVersion": 1,
  "id": "canvas-settings-pr1-test",
  "title": "Test settings",
  "description": "Designer-only test of contributed stock fields.",
  "order": 40,
  "enabled": true,
  "slots": [{"id": "pr1-test.options", "accepts": ["field"],
    "orderBy": ["order", "presetId", "id"]}],
  "fields": []
}
